{
  "plan_id": "example-feature-rollout",
  "workflow_name": "Example feature rollout",
  "summary": "Deliver the example feature as two approval-ready, commit-worthy slices.",
  "mode": "ship",
  "base_branch": "origin/main",
  "request_codex_review": true,
  "requirements": [
    {
      "id": "R1",
      "kind": "behavior",
      "text": "Land the first behavior change in an isolated slice."
    },
    {
      "id": "R2",
      "kind": "behavior",
      "text": "Land the follow-up behavior change in a second isolated slice."
    },
    {
      "id": "R3",
      "kind": "verification",
      "text": "Each slice declares the command that verifies it before approval."
    }
  ],
  "assumptions": [
    "The existing example modules are the correct extension points."
  ],
  "open_questions": [],
  "out_of_scope": [
    "Additional refactors beyond the two verified slices."
  ],
  "steps": [
    {
      "id": "step-1",
      "title": "Add the first verified slice",
      "goal": "Land the first commit-worthy behavior change.",
      "requirement_ids": [
        "R1",
        "R3"
      ],
      "context": [
        "app/example/module.py",
        "tests/example/test_module.py"
      ],
      "planned_updates": [
        "app/example/module.py",
        "tests/example/test_module.py"
      ],
      "planned_creates": [],
      "constraints": [
        "Keep the diff scoped to the first slice."
      ],
      "justification": "This isolates the first behavior change so review and rollback remain simple.",
      "files_read_first": [
        "app/example/module.py",
        "tests/example/test_module.py"
      ],
      "interfaces_to_preserve": [
        "Example module public behavior contract"
      ],
      "avoid_touching": [
        "app/example/second_module.py"
      ],
      "verification_targets": [
        "tests/example/test_module.py"
      ],
      "risk_flags": [
        "Consumer behavior must remain stable for current callers."
      ],
      "blast_radius": [
        "app/example/module.py consumers",
        "tests/example/test_module.py"
      ],
      "decision_ids": [
        "D-EXAMPLE-STEP-1"
      ],
      "depends_on": [],
      "wave": 1,
      "file_ownership": [
        "app/example/module.py",
        "tests/example/test_module.py"
      ],
      "rollback_notes": [
        "Revert the step 1 commit if the first verified slice regresses current callers."
      ],
      "operational_watchpoints": [
        "Watch the example module public behavior contract during review and verification."
      ],
      "agents_update_required": false,
      "done_when": [
        "The behavior works.",
        "The targeted test passes."
      ],
      "verify_cmds": [
        "uv run pytest tests/example/test_module.py"
      ],
      "commit_message": "feature: add first verified slice"
    },
    {
      "id": "step-2",
      "title": "Land the follow-up slice",
      "goal": "Complete the second commit-worthy behavior change.",
      "requirement_ids": [
        "R2",
        "R3"
      ],
      "context": [
        "app/example/second_module.py",
        "tests/example/test_second_module.py"
      ],
      "planned_updates": [
        "app/example/second_module.py",
        "tests/example/test_second_module.py"
      ],
      "planned_creates": [],
      "constraints": [
        "Keep the follow-up scoped to the second slice."
      ],
      "justification": "This lands the second behavior change without reopening the first slice.",
      "files_read_first": [
        "app/example/second_module.py",
        "tests/example/test_second_module.py"
      ],
      "interfaces_to_preserve": [
        "Second example module public behavior contract"
      ],
      "avoid_touching": [
        "app/example/module.py"
      ],
      "verification_targets": [
        "tests/example/test_module.py",
        "tests/example/test_second_module.py"
      ],
      "validation_ownership": [
        "tests/example/test_module.py"
      ],
      "risk_flags": [
        "Step 1 behavior must remain intact after the follow-up slice."
      ],
      "blast_radius": [
        "app/example/second_module.py consumers"
      ],
      "decision_ids": [
        "D-EXAMPLE-STEP-2"
      ],
      "depends_on": [
        "step-1"
      ],
      "wave": 2,
      "file_ownership": [
        "app/example/second_module.py",
        "tests/example/test_second_module.py"
      ],
      "rollback_notes": [
        "Revert only the step 2 commit if the follow-up slice destabilizes the first slice."
      ],
      "operational_watchpoints": [
        "Watch downstream consumers of the second example module while step 2 lands."
      ],
      "agents_update_required": false,
      "done_when": [
        "The second slice works.",
        "The first slice still passes its regression coverage.",
        "The follow-up targeted test passes."
      ],
      "verify_cmds": [
        "uv run pytest tests/example/test_module.py tests/example/test_second_module.py"
      ],
      "commit_message": "feature: land the follow-up slice"
    }
  ]
}
